rank,provider,route_status,readiness_score,provider_type,primary_url,fallback_url,expected_format,expected_schema_candidates,expected_row_range,strengths,risks,planned_phase_b,route_decision_reason
1,hkex_securities_list,SELECTED_AS_NEXT_PROVIDER_ROUTE,96,official_exchange_file,https://www.hkex.com.hk/eng/services/trading/securities/securitieslists/ListOfSecurities.xlsx,https://www.hkex.com.hk/Services/Trading/Securities/Securities-Lists?sc_lang=en,xlsx,"stock_code,name_of_securities,category,sub_category,isin,board_lot",3000-8000,"Official direct XLSX route, includes security names and ISIN, low scraping risk.",May include non-common-equity instruments; needs conservative filtering in validation.,v2.12B_HKEX_ACQUISITION_PLAN,"Best next route because it is official, direct-file, schema-rich and low brittleness."
2,asx_listed_companies,BACKUP_ROUTE_READY,92,official_exchange_csv,https://www.asx.com.au/asx/research/ASXListedCompanies.csv,https://www.asx.com.au/markets/trade-our-cash-market/directory,csv,"company_name,asx_code,gics_industry_group",1500-2500,"Official direct CSV route, very low acquisition complexity.",Likely too small alone for 50k; may lack ISIN.,v2.12B_ASX_ACQUISITION_PLAN_IF_HKEX_BLOCKED_OR_AFTER_HKEX,Excellent low-risk backup and possible add-on provider.
3,tsx_tmx_listed_company_directory,BACKUP_ROUTE_READY,86,official_exchange_directory,https://www.tsx.com/en/listings/listing-with-us/listed-company-directory,https://www.tsx.com/en/listings,html_or_download_link,"company_name,symbol,exchange,issuer_status",3000-5000,Official issuer directory; may expose full issuer list download.,Download link may require discovery; may mix TSX and TSXV.,v2.12B_TMX_ROUTE_IF_HKEX_OR_ASX_NOT_ENOUGH,Useful later route but not the cleanest immediate direct-file target.
4,euronext_equities_live_directory,DEFERRED_ROUTE_CANDIDATE,82,official_exchange_directory,https://live.euronext.com/en/products/equities/list,https://live.euronext.com/en/products/equities,html_or_discovered_endpoint,"name,symbol,isin,market,currency",1500-8000,Official Euronext equity directory; potentially useful EU expansion.,May require pagination or endpoint discovery; avoid brittle scraping.,v2.12B_EURONEXT_ROUTE_IF_DIRECT_ENDPOINT_FOUND,Promising but less direct than HKEX/ASX.
5,deutsche_boerse_xetra_tradable_instruments,DEFERRED_ROUTE_CANDIDATE,78,official_exchange_directory_or_downloads,https://www.cashmarket.deutsche-boerse.com/cash-en/trading/Tradable-Instruments-Xetra,https://www.cashmarket.deutsche-boerse.com/cash-en/trading/Tradable-Instruments-Xetra/Downloads,html_or_downloads,"instrument,name,isin,currency,market_segment",5000-15000,Official Xetra tradable instruments route.,Reference files may require document-guided discovery; avoid brittle parsing.,v2.12B_XETRA_ROUTE_IF_DIRECT_FILE_FOUND,"High potential, but direct-file path needs more careful route discovery."
6,jpx_listed_company_search,DEFERRED_ROUTE_CANDIDATE,74,official_exchange_search_page,https://www.jpx.co.jp/english/listing/co-search/index.html,https://www.jpx.co.jp/english/listing/,html_or_search_export,"code,company_name,market_segment,isin_possible",3500-4500,Official JPX listed company route.,Export availability must be confirmed; may require HTML parsing.,v2.12B_JPX_ROUTE_IF_EXPORT_CONFIRMED,Good candidate but not selected first because HKEX has a clearer direct file.
